{
  "$schema": "https://json-schema.org/draft/2020-12/schema",
  "$id": "https://roaringlions.dev/schemas/names.schema.json",
  "title": "Unit name table",
  "description": "The screened names the app assigns to surviving units (spec 2026-09-10 §4.7; storyline §2.4 rule 4). Squads get a callsign, vehicles a hull number and a painted name, drones and the Peten a task number. Single common nouns in the materiel register, each screened and dated; never a given-name plus surname, a toponym, a real force's platform or unit, or a religious term. Names are issued in table order by a per-kind counter on the ledger, never drawn at random.",
  "type": "object",
  "required": ["kinds", "squads", "vehicles", "tasks"],
  "additionalProperties": false,
  "properties": {
    "kinds": {
      "type": "object",
      "required": ["task_roles", "vehicle_roles", "vehicle_ids"],
      "additionalProperties": false,
      "properties": {
        "task_roles": { "type": "array", "items": { "type": "string" } },
        "vehicle_roles": { "type": "array", "items": { "type": "string" } },
        "vehicle_ids": { "type": "array", "items": { "type": "string" } }
      }
    },
    "squads": { "type": "array", "minItems": 1, "items": { "$ref": "#/$defs/named" } },
    "vehicles": {
      "type": "array",
      "minItems": 1,
      "items": {
        "type": "object",
        "required": ["hull", "name", "screened"],
        "additionalProperties": false,
        "properties": {
          "hull": { "type": "string", "pattern": "^[1-9]-[1-9]$" },
          "name": { "$ref": "#/$defs/noun" },
          "screened": { "$ref": "#/$defs/date" }
        }
      }
    },
    "tasks": { "type": "array", "minItems": 1, "items": { "$ref": "#/$defs/named" } }
  },
  "$defs": {
    "noun": { "type": "string", "pattern": "^[A-Z][a-z']+( [A-Z][a-z]+)?$" },
    "date": { "type": "string", "pattern": "^\\d{4}-\\d{2}-\\d{2}$" },
    "named": {
      "type": "object",
      "required": ["name", "screened"],
      "additionalProperties": false,
      "properties": {
        "name": { "$ref": "#/$defs/noun" },
        "screened": { "$ref": "#/$defs/date" }
      }
    }
  }
}
