{
  "kinds": {
    "task_roles": ["drone", "gunship"],
    "vehicle_roles": ["apc", "ifv", "mbt", "recon"],
    "vehicle_ids": ["dozer_d9", "aa_remetz", "demo_tzav"]
  },
  "squads": [
    { "name": "Sela", "screened": "2026-09-11" },
    { "name": "Barzel", "screened": "2026-09-11" },
    { "name": "Tzur", "screened": "2026-09-11" },
    { "name": "Marom", "screened": "2026-09-11" },
    { "name": "Keshet", "screened": "2026-09-11" },
    { "name": "Migdal", "screened": "2026-09-11" },
    { "name": "Chatzatz", "screened": "2026-09-13" },
    { "name": "Cheres", "screened": "2026-09-13" },
    { "name": "Rogem", "screened": "2026-09-13" },
    { "name": "Gova", "screened": "2026-09-13" },
    { "name": "Rekhes", "screened": "2026-09-13" },
    { "name": "Nakik", "screened": "2026-09-13" },
    { "name": "Solela", "screened": "2026-09-13" },
    { "name": "Te'ala", "screened": "2026-09-13" },
    { "name": "Eshnav", "screened": "2026-09-13" },
    { "name": "Mashkof", "screened": "2026-09-13" },
    { "name": "Mesila", "screened": "2026-09-13" },
    { "name": "Shvil", "screened": "2026-09-13" },
    { "name": "Tzinor", "screened": "2026-09-13" },
    { "name": "Tomech", "screened": "2026-09-13" },
    { "name": "Zavit", "screened": "2026-09-13" },
    { "name": "Zefet", "screened": "2026-09-13" },
    { "name": "Shayish", "screened": "2026-09-13" },
    { "name": "Tashtit", "screened": "2026-09-13" },
    { "name": "Mishlat", "screened": "2026-09-13" },
    { "name": "Charitz", "screened": "2026-09-13" },
    { "name": "Levena", "screened": "2026-09-13" },
    { "name": "Tiyach", "screened": "2026-09-13" },
    { "name": "Mivneh", "screened": "2026-09-13" },
    { "name": "Mishkefet", "screened": "2026-09-13" },
    { "name": "Tarmil", "screened": "2026-09-13" },
    { "name": "Afuda", "screened": "2026-09-13" },
    { "name": "Adasha", "screened": "2026-09-13" },
    { "name": "Marpek", "screened": "2026-09-13" },
    { "name": "Tzel", "screened": "2026-09-13" },
    { "name": "Kefor", "screened": "2026-09-13" },
    { "name": "Mafsek", "screened": "2026-09-13" },
    { "name": "Matzlema", "screened": "2026-09-13" },
    { "name": "Gavshush", "screened": "2026-09-13" },
    { "name": "Kivun", "screened": "2026-09-13" }
  ],
  "vehicles": [
    { "hull": "1-2", "name": "Ayil", "screened": "2026-09-11" },
    { "hull": "2-1", "name": "Gachelet", "screened": "2026-09-11" },
    { "hull": "2-4", "name": "Yated", "screened": "2026-09-11" },
    { "hull": "4-2", "name": "Kardom", "screened": "2026-09-13" },
    { "hull": "7-2", "name": "Mesor", "screened": "2026-09-13" },
    { "hull": "5-1", "name": "Mafuach", "screened": "2026-09-13" },
    { "hull": "5-4", "name": "Masmer", "screened": "2026-09-13" },
    { "hull": "1-3", "name": "Bereach", "screened": "2026-09-13" },
    { "hull": "4-3", "name": "Manul", "screened": "2026-09-13" },
    { "hull": "7-3", "name": "Tzir", "screened": "2026-09-13" },
    { "hull": "1-5", "name": "Retzua", "screened": "2026-09-13" },
    { "hull": "4-5", "name": "Machresha", "screened": "2026-09-13" },
    { "hull": "7-5", "name": "Kivshan", "screened": "2026-09-13" },
    { "hull": "1-6", "name": "Chishuk", "screened": "2026-09-13" },
    { "hull": "4-6", "name": "Makdecha", "screened": "2026-09-13" },
    { "hull": "7-6", "name": "Ma'ader", "screened": "2026-09-13" },
    { "hull": "1-7", "name": "Boreg", "screened": "2026-09-13" },
    { "hull": "4-7", "name": "Chishur", "screened": "2026-09-13" },
    { "hull": "7-7", "name": "Shlada", "screened": "2026-09-13" },
    { "hull": "1-8", "name": "Tzamig", "screened": "2026-09-13" },
    { "hull": "4-8", "name": "Kefitz", "screened": "2026-09-13" },
    { "hull": "7-8", "name": "Migun", "screened": "2026-09-13" },
    { "hull": "1-9", "name": "Machsan", "screened": "2026-09-13" },
    { "hull": "4-9", "name": "Metach", "screened": "2026-09-13" },
    { "hull": "7-9", "name": "Mafselet", "screened": "2026-09-13" }
  ],
  "tasks": [
    { "name": "Eye One", "screened": "2026-09-13" },
    { "name": "Kite One", "screened": "2026-09-11" },
    { "name": "Lens One", "screened": "2026-09-13" },
    { "name": "Gimbal One", "screened": "2026-09-13" },
    { "name": "Aperture One", "screened": "2026-09-13" },
    { "name": "Spool One", "screened": "2026-09-13" },
    { "name": "Eye Two", "screened": "2026-09-11" },
    { "name": "Kite Two", "screened": "2026-09-13" },
    { "name": "Lens Two", "screened": "2026-09-13" },
    { "name": "Gimbal Two", "screened": "2026-09-13" },
    { "name": "Aperture Two", "screened": "2026-09-13" },
    { "name": "Spool Two", "screened": "2026-09-13" },
    { "name": "Eye Three", "screened": "2026-09-13" },
    { "name": "Kite Three", "screened": "2026-09-13" },
    { "name": "Lens Three", "screened": "2026-09-13" },
    { "name": "Gimbal Three", "screened": "2026-09-13" },
    { "name": "Aperture Three", "screened": "2026-09-13" },
    { "name": "Spool Three", "screened": "2026-09-13" },
    { "name": "Eye Four", "screened": "2026-09-13" },
    { "name": "Kite Four", "screened": "2026-09-13" },
    { "name": "Lens Four", "screened": "2026-09-13" },
    { "name": "Gimbal Four", "screened": "2026-09-13" },
    { "name": "Aperture Four", "screened": "2026-09-13" },
    { "name": "Spool Four", "screened": "2026-09-13" }
  ]
}
